[
  {
    "schemaVersion": "1.1.0",
    "snapshotId": "6e91ec67-5db6-49ca-8de4-6785d6413913",
    "collectedAt": "2026-08-06T21:49:00Z",
    "targetSeason": "2026-27",
    "player": {
      "id": "d4a1c944-c7fd-4f1c-b5e4-0f088540df2f",
      "canonicalName": "Nico Paz",
      "normalizedName": "nico paz",
      "birthDate": "2004-09-08",
      "team": "Como",
      "roles": {
        "classic": [
          "C"
        ],
        "mantra": [
          "T"
        ]
      },
      "sourceIds": {
        "fantacalcio": 6875,
        "fpedia": 3803,
        "serieA": "nicolas-paz-martinez"
      }
    },
    "eligibility": {
      "status": "active",
      "canonicalSource": "fantacalcio.it",
      "verified": true,
      "verificationMethod": "profile_page",
      "verifiedAt": "2026-08-06T21:49:00Z",
      "notes": [
        "Current official profile exposes a 2026-27 pre-season quotation and FVM."
      ]
    },
    "sources": {
      "fantacalcio": {
        "status": "success",
        "url": "https://www.fantacalcio.it/serie-a/squadre/como/paz-n/6875/2025-26",
        "evidence": {
          "retrievalMode": "live_http_research_proxy",
          "observedAt": "2026-08-06T21:49:00Z",
          "httpStatus": null,
          "contentType": "text/html",
          "contentSha256": null,
          "parserVersion": "fantacalcio-parser@0.1.0",
          "accessVerified": true,
          "responseShape": "server_rendered_html"
        },
        "data": {
          "playerId": 6875,
          "name": "Nico Paz",
          "team": "Como",
          "birthDate": "2004-09-08",
          "heightCm": 185,
          "foot": "Sx",
          "nationalities": [
            "Argentina",
            "Spagna"
          ],
          "seasonObserved": "2025-26",
          "ratings": {
            "average": 6.37,
            "fantasyAverage": 7.3
          },
          "quotations": {
            "classic": 26,
            "mantra": 26
          },
          "fvmPer1000": {
            "classic": 245,
            "mantra": 245
          },
          "stats": {
            "appearancesWithGrade": 35,
            "goals": 12,
            "assists": 5,
            "yellowCards": 5,
            "redCards": 0,
            "ownGoals": 0,
            "goalsConceded": null,
            "penaltiesScored": 0,
            "penaltiesTaken": 2,
            "penaltiesSaved": null
          },
          "availabilitySummary": {
            "started": 33,
            "entered": 2,
            "suspended": 0,
            "injured": 0,
            "unused": 3
          }
        }
      },
      "fpedia": {
        "status": "success",
        "url": "https://www.fantacalciopedia.com/lista-calciatori-serie-a/centrocampisti/3803/paz-nico.html",
        "evidence": {
          "retrievalMode": "live_http_research_proxy",
          "observedAt": "2026-08-06T21:49:00Z",
          "httpStatus": null,
          "contentType": "text/html",
          "contentSha256": null,
          "parserVersion": "fpedia-parser@0.1.0",
          "accessVerified": true,
          "responseShape": "server_rendered_html"
        },
        "data": {
          "playerId": 3803,
          "name": "PAZ NICO",
          "team": "Como",
          "role": "CEN",
          "birthDate": "2004-09-08",
          "heightCm": 185,
          "weightKg": 77,
          "nationality": "Argentina",
          "algorithmScore": 98,
          "fcpScore": 81,
          "investmentSolidityPct": 80,
          "injuryResistancePct": 60,
          "currentSeason": {
            "season": "2025-26",
            "appearances": 35,
            "fantasyAverage": 7.3,
            "fantasyAverageAllRounds": 6.72
          },
          "history": [
            {
              "season": "2025-26",
              "appearances": 35,
              "fantasyAverage": 7.3
            },
            {
              "season": "2024-25",
              "appearances": 33,
              "fantasyAverage": 6.89
            },
            {
              "season": "2023-24",
              "appearances": 0,
              "fantasyAverage": null
            }
          ],
          "projection": {
            "targetSeason": "2026-27",
            "appearances": {
              "raw": "30+",
              "min": 30,
              "max": null
            },
            "goals": {
              "raw": "4/7",
              "min": 4,
              "max": 7
            },
            "assists": {
              "raw": "3/5",
              "min": 3,
              "max": 5
            }
          },
          "skills": [
            "Fuoriclasse",
            "Titolare",
            "Buona Media",
            "Goleador",
            "Assistman",
            "Rigorista",
            "Piazzati",
            "Giovane talento"
          ],
          "flags": {
            "newSigning": false,
            "injured": false,
            "recommendedNextRound": false
          }
        }
      },
      "serieA": {
        "status": "partial",
        "profileUrl": "https://www1.legaseriea.it/players/nicolas-paz-martinez",
        "statisticsUrl": "https://www.legaseriea.it/players/nicolas-paz-martinez/statistics",
        "evidence": {
          "retrievalMode": "live_http_research_proxy",
          "observedAt": "2026-08-06T21:49:00Z",
          "httpStatus": null,
          "contentType": "text/html",
          "contentSha256": null,
          "parserVersion": "serie-a-parser@0.1.0",
          "accessVerified": true,
          "responseShape": "partial_server_rendered_html"
        },
        "access": {
          "public": true,
          "authenticationRequired": false,
          "profileIdentityAvailable": true,
          "aggregateStatisticsAvailable": false,
          "simpleHttpCollectionRecommended": false,
          "browserExecutionLikelyRequired": true,
          "recommendedUse": "identity_only"
        },
        "data": {
          "identity": {
            "shirtNumber": 10,
            "name": "Nicolas Paz Martinez",
            "team": "Como",
            "nationality": "Argentina",
            "position": "Midfielder",
            "birthDate": "2004-09-08",
            "heightCm": 186,
            "weightKg": 74
          },
          "statistics": {
            "status": "no_data_for_selected_season",
            "season": null,
            "matchesPlayed": null,
            "minutesPlayed": null,
            "goals": null,
            "assists": null,
            "yellowCards": null,
            "redCards": null,
            "shotsTotal": null,
            "shotsOnTarget": null,
            "passingAccuracyPct": null,
            "distanceKmTotal": null
          }
        },
        "reason": "The public profile identity is server-rendered, but the aggregate statistics page returned NO DATA AVAILABLE or a loading shell during the live verification. Do not use it as the primary statistics feed without discovering the underlying API or running a browser adapter."
      }
    },
    "quality": {
      "contractValid": true,
      "identity": {
        "nameMatch": true,
        "birthDateMatch": true,
        "teamMatch": true,
        "confidence": 1.0
      },
      "coverage": {
        "fantacalcio": "complete",
        "fpedia": "complete",
        "serieA": "identity_only"
      },
      "warnings": [
        "Lega Serie A reports 186 cm while Fantacalcio.it and FPEDIA report 185 cm.",
        "Lega Serie A aggregate player statistics were not available through a stable simple HTTP response during verification; source retained for identity only."
      ]
    }
  },
  {
    "schemaVersion": "1.1.0",
    "snapshotId": "c53fc94d-9b42-4992-818a-eec8afcbf530",
    "collectedAt": "2026-08-06T21:49:00Z",
    "targetSeason": "2026-27",
    "player": {
      "id": "52868df2-0d83-43c4-9041-c337e86872ac",
      "canonicalName": "David De Gea",
      "normalizedName": "david de gea",
      "birthDate": "1990-11-07",
      "team": "Fiorentina",
      "roles": {
        "classic": [
          "P"
        ],
        "mantra": [
          "Por"
        ]
      },
      "sourceIds": {
        "fantacalcio": 2521,
        "fpedia": 3770,
        "serieA": "david-de-gea-quintana"
      }
    },
    "eligibility": {
      "status": "active",
      "canonicalSource": "fantacalcio.it",
      "verified": true,
      "verificationMethod": "current_roster",
      "verifiedAt": "2026-08-06T21:49:00Z",
      "notes": [
        "Official Fiorentina profile/roster page contains player ID 2521."
      ]
    },
    "sources": {
      "fantacalcio": {
        "status": "success",
        "url": "https://www.fantacalcio.it/serie-a/squadre/fiorentina/de-gea/2521/2025-26",
        "evidence": {
          "retrievalMode": "live_http_research_proxy",
          "observedAt": "2026-08-06T21:49:00Z",
          "httpStatus": null,
          "contentType": "text/html",
          "contentSha256": null,
          "parserVersion": "fantacalcio-parser@0.1.0",
          "accessVerified": true,
          "responseShape": "server_rendered_html"
        },
        "data": {
          "playerId": 2521,
          "name": "David De Gea",
          "team": "Fiorentina",
          "birthDate": "1990-11-07",
          "heightCm": 189,
          "foot": "Dx",
          "nationalities": [
            "Spagna"
          ],
          "seasonObserved": "2025-26",
          "ratings": {
            "average": 6.24,
            "fantasyAverage": 5.0
          },
          "quotations": {
            "classic": 12,
            "mantra": 12
          },
          "fvmPer1000": {
            "classic": 28,
            "mantra": 28
          },
          "stats": {
            "appearancesWithGrade": 37,
            "goals": null,
            "assists": 0,
            "yellowCards": 0,
            "redCards": 0,
            "ownGoals": 0,
            "goalsConceded": 49,
            "penaltiesScored": null,
            "penaltiesTaken": null,
            "penaltiesSaved": 1